{
  "version": 1,
  "tools": [
    {
      "id": "claude",
      "name": "Claude",
      "env_vars": [
        "ANTHROPIC_API_KEY",
        "ANTHROPIC_AUTH_TOKEN"
      ],
      "vendor": "Anthropic",
      "category": "assistant",
      "license_group": "anthropic-claude",
      "approved": false,
      "added_by": "manual",
      "domains": [
        "claude.ai",
        "anthropic.com",
        "api.anthropic.com",
        "claude.com",
        "claudeusercontent.com",
        "console.anthropic.com"
      ],
      "inference_domains": [
        "api.anthropic.com"
      ],
      "app_names": [
        "Claude.app",
        "Claude"
      ],
      "bundle_ids": [
        "com.anthropic.claudefordesktop"
      ],
      "mcp_config_paths_macos": [
        "Library/Application Support/Claude/claude_desktop_config.json"
      ],
      "mcp_config_paths_windows": [
        "AppData/Roaming/Claude/claude_desktop_config.json"
      ],
      "mcp_config_paths_linux": [
        ".config/Claude/claude_desktop_config.json"
      ],
      "email_senders": [
        "anthropic.com",
        "mail.anthropic.com"
      ],
      "risk_tier": "high",
      "mcp_identifiers": [
        "anthropic-claude"
      ],
      "exe_names": [
        "claude.exe"
      ],
      "notes": "Claude desktop app supports MCP server connections."
    },
    {
      "id": "claude-code",
      "name": "Claude Code",
      "env_vars": [
        "ANTHROPIC_API_KEY",
        "CLAUDE_CODE_OAUTH_TOKEN"
      ],
      "vendor": "Anthropic",
      "category": "coding",
      "license_group": "anthropic-claude",
      "approved": false,
      "added_by": "manual",
      "domains": [],
      "extension_ids": {
        "vscode": [
          "anthropic.claude-code"
        ]
      },
      "cli": {
        "config_paths": [
          ".claude.json",
          ".claude"
        ],
        "account_json_path": ".claude.json",
        "account_json_keys": [
          "oauthAccount",
          "emailAddress"
        ],
        "binaries": [
          "claude"
        ]
      },
      "mcp_config_paths": [
        ".claude.json"
      ],
      "risk_tier": "high",
      "email_senders": [
        "anthropic.com"
      ],
      "notes": "CLI tool with agentic capabilities."
    },
    {
      "id": "chatgpt",
      "name": "ChatGPT",
      "env_vars": [
        "OPENAI_API_KEY"
      ],
      "vendor": "OpenAI",
      "category": "assistant",
      "license_group": "openai-chatgpt",
      "approved": false,
      "added_by": "manual",
      "domains": [
        "chat.openai.com",
        "chatgpt.com",
        "openai.com",
        "api.openai.com",
        "cdn.oaistatic.com",
        "auth0.openai.com"
      ],
      "inference_domains": [
        "api.openai.com",
        "chat.openai.com"
      ],
      "app_names": [
        "ChatGPT.app",
        "ChatGPT"
      ],
      "bundle_ids": [
        "com.openai.chat"
      ],
      "extension_ids": {
        "vscode": [
          "openai.chatgpt"
        ]
      },
      "email_senders": [
        "openai.com",
        "tm.openai.com",
        "email.openai.com"
      ],
      "risk_tier": "high",
      "exe_names": [
        "ChatGPT.exe"
      ],
      "notes": "Users can sign up with work email + password without any Entra involvement."
    },
    {
      "id": "codex-cli",
      "name": "Codex CLI",
      "env_vars": [
        "OPENAI_API_KEY",
        "CODEX_API_KEY"
      ],
      "vendor": "OpenAI",
      "category": "coding",
      "license_group": "openai-chatgpt",
      "approved": false,
      "added_by": "manual",
      "domains": [],
      "cli": {
        "config_paths": [
          ".codex"
        ],
        "account_json_path": ".codex/auth.json",
        "account_jwt_path": [
          "tokens",
          "id_token"
        ],
        "account_jwt_claim": "email",
        "binaries": [
          "codex"
        ]
      },
      "risk_tier": "medium"
    },
    {
      "id": "gemini",
      "name": "Gemini",
      "vendor": "Google",
      "category": "assistant",
      "license_group": "google-gemini",
      "approved": false,
      "added_by": "manual",
      "domains": [
        "gemini.google.com",
        "aistudio.google.com",
        "generativelanguage.googleapis.com"
      ],
      "email_senders": [
        "google.com"
      ],
      "risk_tier": "high"
    },
    {
      "id": "gemini-cli",
      "name": "Gemini CLI",
      "env_vars": [
        "GEMINI_API_KEY",
        "GOOGLE_API_KEY"
      ],
      "vendor": "Google",
      "category": "coding",
      "license_group": "google-gemini",
      "approved": false,
      "added_by": "manual",
      "domains": [],
      "extension_ids": {
        "vscode": [
          "google.geminicodeassist"
        ]
      },
      "cli": {
        "config_paths": [
          ".gemini"
        ],
        "account_json_path": ".gemini/google_accounts.json",
        "account_json_keys": [
          "active"
        ],
        "binaries": [
          "gemini"
        ]
      },
      "risk_tier": "medium"
    },
    {
      "id": "github-copilot",
      "name": "GitHub Copilot",
      "vendor": "GitHub",
      "category": "coding",
      "approved": false,
      "added_by": "manual",
      "domains": [
        "copilot-proxy.githubusercontent.com",
        "api.githubcopilot.com",
        "copilot.github.com"
      ],
      "inference_domains": [
        "api.githubcopilot.com",
        "copilot-proxy.githubusercontent.com"
      ],
      "extension_ids": {
        "vscode": [
          "github.copilot",
          "github.copilot-chat"
        ],
        "jetbrains": [
          "github-copilot"
        ]
      },
      "risk_tier": "medium",
      "email_senders": [
        "github.com"
      ]
    },
    {
      "id": "cursor",
      "name": "Cursor",
      "env_vars": [
        "CURSOR_API_KEY"
      ],
      "vendor": "Anysphere",
      "category": "coding",
      "approved": false,
      "added_by": "manual",
      "domains": [
        "cursor.com",
        "cursor.sh",
        "api2.cursor.sh"
      ],
      "form": "ide",
      "inference_domains": [
        "api2.cursor.sh"
      ],
      "app_names": [
        "Cursor.app",
        "Cursor"
      ],
      "bundle_ids": [
        "com.todesktop.230313mzl4w4u92"
      ],
      "cli": {
        "config_paths": [
          ".cursor"
        ]
      },
      "mcp_config_paths": [
        ".cursor/mcp.json"
      ],
      "email_senders": [
        "cursor.com",
        "cursor.sh"
      ],
      "risk_tier": "high",
      "exe_names": [
        "Cursor.exe"
      ]
    },
    {
      "id": "cline",
      "name": "Cline",
      "vendor": "Cline Bot Inc",
      "category": "coding",
      "approved": false,
      "added_by": "manual",
      "domains": [
        "api.cline.bot"
      ],
      "extension_ids": {
        "vscode": [
          "saoudrizwan.claude-dev"
        ]
      },
      "risk_tier": "medium"
    },
    {
      "id": "roo-code",
      "name": "Roo Code",
      "vendor": "Roo Veterinary Inc",
      "category": "coding",
      "approved": false,
      "added_by": "manual",
      "domains": [],
      "extension_ids": {
        "vscode": [
          "rooveterinaryinc.roo-cline"
        ]
      },
      "risk_tier": "medium"
    },
    {
      "id": "continue",
      "name": "Continue",
      "vendor": "Continue Dev",
      "category": "coding",
      "approved": false,
      "added_by": "manual",
      "domains": [
        "continue.dev"
      ],
      "extension_ids": {
        "vscode": [
          "continue.continue"
        ]
      },
      "risk_tier": "medium"
    },
    {
      "id": "codeium",
      "name": "Windsurf / Devin (Cognition)",
      "vendor": "Cognition",
      "category": "coding",
      "approved": false,
      "added_by": "manual",
      "domains": [
        "codeium.com",
        "windsurf.com",
        "server.codeium.com",
        "codeiumdata.com",
        "devin.ai",
        "app.devin.ai",
        "api.devin.ai",
        "cognition.ai"
      ],
      "form": "ide",
      "inference_domains": [
        "server.codeium.com",
        "api.devin.ai"
      ],
      "app_names": [
        "Windsurf.app",
        "Windsurf"
      ],
      "extension_ids": {
        "vscode": [
          "codeium.codeium"
        ]
      },
      "risk_tier": "high",
      "email_senders": [
        "codeium.com",
        "windsurf.com",
        "devin.ai",
        "cognition.ai"
      ],
      "bundle_ids": [
        "com.codeium.windsurf"
      ],
      "exe_names": [
        "Windsurf.exe"
      ]
    },
    {
      "id": "tabnine",
      "name": "Tabnine",
      "vendor": "Tabnine",
      "category": "coding",
      "approved": false,
      "added_by": "manual",
      "domains": [
        "tabnine.com",
        "api.tabnine.com"
      ],
      "inference_domains": [
        "api.tabnine.com"
      ],
      "extension_ids": {
        "vscode": [
          "tabnine.tabnine-vscode"
        ]
      },
      "risk_tier": "medium"
    },
    {
      "id": "otter",
      "name": "Otter",
      "vendor": "Otter.ai",
      "category": "transcription",
      "approved": false,
      "added_by": "manual",
      "domains": [
        "otter.ai",
        "api.otter.ai"
      ],
      "inference_domains": [
        "api.otter.ai"
      ],
      "app_names": [
        "Otter.app",
        "Otter"
      ],
      "email_senders": [
        "otter.ai"
      ],
      "risk_tier": "high",
      "bundle_ids": [
        "ai.otter.otter"
      ],
      "exe_names": [
        "Otter.exe"
      ],
      "extension_ids": {
        "chrome": [
          "bnmojkbbkkonlmlfgejehefjldooied"
        ]
      }
    },
    {
      "id": "grammarly",
      "name": "Grammarly",
      "vendor": "Grammarly",
      "category": "writing",
      "approved": false,
      "added_by": "manual",
      "domains": [
        "grammarly.com",
        "in.grammarly.com",
        "app.grammarly.com",